{
  "schemaVersion": "1.0.0",
  "release": "v1",
  "network": "testnet",
  "networkPassphrase": "Test SDF Network ; September 2015",
  "rpcUrl": "https://soroban-testnet.stellar.org",
  "horizonUrl": "https://horizon-testnet.stellar.org",
  "deploymentLedger": null,
  "deployedAt": null,
  "deployer": null,
  "admin": null,
  "multisig": null,
  "deploymentStatus": "template",
  "contracts": {
    "stealthRegistry": {
      "id": "",
      "wasmHash": "",
      "package": "stealth-registry"
    },
    "stealthAnnouncer": {
      "id": "",
      "wasmHash": "",
      "package": "stealth-announcer"
    },
    "groth16Verifier": {
      "id": "",
      "wasmHash": "",
      "package": "groth16-verifier"
    },
    "reputationVerifier": {
      "id": "",
      "wasmHash": "",
      "package": "reputation-verifier"
    },
    "schemaRegistry": {
      "id": "",
      "wasmHash": "",
      "package": "schema-registry"
    },
    "attestationEngineV2": {
      "id": "",
      "wasmHash": "",
      "package": "attestation-engine-v2"
    }
  },
  "artifacts": {
    "frontend": {
      "buildCommit": null,
      "repository": "https://github.com/collinsadi/opaque"
    },
    "circuits": {
      "v2": {
        "r1csHash": null,
        "verificationKeyHash": null
      }
    }
  },
  "verification": {
    "command": "stellar contract build && node scripts/verify-deployment-manifest.mjs --network testnet --check-wasm",
    "output": null
  }
}
